[
  {
    "checkpoint_key": "post-blanqueo-recovery-checkpoint",
    "dependencies": [],
    "expected_files": [
      "lessons_learned/blanqueo-2026-05-27.md"
    ],
    "goal": "Analizar causa raiz, validar workspace limpio y ajustar politicas preventivas.",
    "id": "POST-BLANQUEO-RECOVERY",
    "max_retries": 0,
    "mode": "build",
    "priority": 100,
    "status": "completed",
    "timeout_seconds": 300,
    "title": "POST-BLANQUEO-RECOVERY",
    "validation_commands": [
      "python3 -B -c \"from pathlib import Path; missing=[p for p in ['lessons_learned/blanqueo-2026-05-27.md'] if not Path(p).is_file()]; assert not missing, missing\"",
      "python3 -B -c \"from pathlib import Path; assert Path('lessons_learned/blanqueo-2026-05-27.md').is_file()\""
    ]
  },
  {
    "checkpoint_key": "runtime-20260528160815-001-checkpoint",
    "dependencies": [],
    "expected_files": [
      "docs/advanced_programming_case_002.md"
    ],
    "goal": "Refactorizar conceptualmente un modulo grande en tres capas con responsabilidades claras.; Escribe la solucion o plan en docs/advanced_programming_case_002.md, manten el cambio pequeno, registra evidencia y no modifiques archivos no relacionados.",
    "id": "RUNTIME-20260528160815-001",
    "max_retries": 2,
    "mode": "build",
    "priority": 10,
    "status": "completed",
    "timeout_seconds": 600,
    "title": "Refactorizar conceptualmente un modulo grande en tres capas",
    "validation_commands": [
      "python3 -B -c \"from pathlib import Path; missing=[p for p in ['docs/advanced_programming_case_002.md'] if not Path(p).is_file()]; assert not missing, missing\""
    ]
  }
]
