[
  {
    "checkpoint_key": "runtime-20260528204354-001-checkpoint",
    "dependencies": [],
    "expected_files": [
      "docs/advanced_programming_case_002.md"
    ],
    "goal": "Refactorizar conceptualmente un modulo grande en tres capas con responsabilidades claras.; Escribe la solucion o plan en docs/advanced_programming_case_002.md, manten el cambio pequeno, registra evidencia y no modifiques archivos no relacionados.",
    "id": "RUNTIME-20260528204354-001",
    "max_retries": 2,
    "mode": "build",
    "priority": 10,
    "status": "completed",
    "timeout_seconds": 600,
    "title": "Refactorizar conceptualmente un modulo grande en tres capas",
    "validation_commands": [
      "python3 -B -c \"from pathlib import Path; missing=[p for p in ['docs/advanced_programming_case_002.md'] if not Path(p).is_file()]; assert not missing, missing\""
    ]
  }
]
