{
  "checkpoint_key": null,
  "dependencies": [],
  "expected_files": [
    "runtime/continuity_probe/prompt-flight-batch-20260528T030206Z-geometry-007/prompt_flight_report.json"
  ],
  "goal": "Trace how one HABLA BASIC prompt would move through internal runtime layers.",
  "id": "PROMPT-FLIGHT-batch-20260528T030206Z-geometry-007",
  "max_retries": 0,
  "mode": "build",
  "priority": 50,
  "status": "pending",
  "timeout_seconds": 180,
  "title": "Prompt flight diagnostic task",
  "validation_commands": [
    "python3 -B -m py_compile orchestrator/continuity_probe.py"
  ]
}
