[
  {
    "checkpoint_key": "runtime-20260528031400-001-checkpoint",
    "dependencies": [],
    "expected_files": [
      "docs/geometry_case_011.md"
    ],
    "goal": "Determinar paralelismo y perpendicularidad de dos rectas.; Escribe la solucion o plan en docs/geometry_case_011.md, manten el cambio pequeno, registra evidencia y no modifiques archivos no relacionados.",
    "id": "RUNTIME-20260528031400-001",
    "max_retries": 2,
    "mode": "build",
    "priority": 10,
    "status": "completed",
    "timeout_seconds": 600,
    "title": "Determinar paralelismo y perpendicularidad de dos rectas.; Escribe",
    "validation_commands": [
      "python3 -B -c \"from pathlib import Path; missing=[p for p in ['docs/geometry_case_011.md'] if not Path(p).is_file()]; assert not missing, missing\""
    ]
  }
]
