[
  {
    "checkpoint_key": "runtime-20260530131600-001-checkpoint",
    "dependencies": [],
    "expected_files": [
      "docs/mathematics_case_031.md"
    ],
    "goal": "Resolver una ecuacion trigonometrica basica en un intervalo dado.; Escribe la solucion o plan en docs/mathematics_case_031.md, manten el cambio pequeno, registra evidencia y no modifiques archivos no relacionados.",
    "id": "RUNTIME-20260530131600-001",
    "max_retries": 2,
    "mode": "build",
    "priority": 10,
    "status": "completed",
    "timeout_seconds": 600,
    "title": "Resolver una ecuacion trigonometrica basica en un intervalo",
    "validation_commands": [
      "python3 -B -c \"from pathlib import Path; missing=[p for p in ['docs/mathematics_case_031.md'] if not Path(p).is_file()]; assert not missing, missing\""
    ]
  }
]
